{
  "schema": {"name": "mollification-supplement-budget", "version": 7},
  "name": "layer-stack-p1-mollification-reference-se-v8",
  "protocol_sha256": "7160bd6f210038a6d2f39cac3ec513287b0cacab3ffb94423737c8e4d0cbbec2",
  "audit_report_sha256": "c85474bc96f8cbf80fd62ded7257e9011cf1f4e0d5150dc05c6ff9c7ede7c13d",
  "supplement_anchor_lock_sha256": "23d865f167809c1e340c4ca9581ea1c1e813b9ef2c6dd7919b9383ff3a9204ac",
  "predecessor_failure": {
    "name": "layer-stack-p1-mollification-reference-se-v7",
    "maximum_paths_per_jitter_per_replica": 131072,
    "state_id": "1796065779d0932fe7ded3cc2c40b84a8a19190dd7e68732f06bc518ae7fe54a",
    "view_index": 6,
    "level_index": 0,
    "observed_relative_se_p95": 0.107237,
    "observed_relative_se_max": 0.19514,
    "published": false,
    "directory": "data/reference-responses/layer-stack-p1-mollification-v1-reference-se-v7"
  },
  "derivation": {
    "rule": "ceil-power-of-two((observed_p95/target_p95)^2*previous_cap)",
    "estimated_required_paths": 418694,
    "rounded_power_of_two": 524288
  },
  "reference_budget": {
    "initial_paths_per_jitter_per_replica": 64,
    "maximum_paths_per_jitter_per_replica": 524288,
    "target_relative_se_p95": 0.06,
    "maximum_group_relative_se": 0.25,
    "jitter_count": 256,
    "replica_count": 2
  },
  "accumulator": {
    "name": "batched-fixed-float64-welford-v1",
    "gpu_batch_samples_per_replica": 256,
    "sample_offset": "contiguous-zero-based-v1",
    "cpu_accumulator": "float64-parallel-welford-v1",
    "implementation_uri": "src/ncls/data/reference.py",
    "implementation_sha256": "8d97c4d5265f800cd2a82fa555e00a1ad7a4063f2b573d56d5200ffdd7970cc2"
  },
  "reuse_policy": {
    "name": "verified-multi-source-state-shard-reuse-v1",
    "promoted_state_ids": [
      "1796065779d0932fe7ded3cc2c40b84a8a19190dd7e68732f06bc518ae7fe54a"
    ],
    "sources": [
      {
        "source_budget_plan_uri": "configs/corpus/layer-stack-p1-mollification-reference-se-v6.json",
        "source_budget_plan_sha256": "dd1cd92e3c49f69556b08d2ab1c3bcc703ff181a33b5baada72924589ed062c5",
        "source_collection_lock_uri": "artifacts/mollification/layer-stack-p1-mollification-reference-se-v6-collection-lock.json",
        "source_collection_lock_sha256": "31e0a376881d01b885b6f107a6fdd818b8840eb821528efecf121551265a25c0",
        "source_shard_root": "data/reference-responses/layer-stack-p1-mollification-v1-reference-se-v6"
      },
      {
        "source_budget_plan_uri": "configs/corpus/layer-stack-p1-mollification-reference-se-v7.json",
        "source_budget_plan_sha256": "18652be10120ca550d951003247e98b9cdd49f609f1c15dabc17b32ae005ded4",
        "source_collection_lock_uri": "artifacts/mollification/layer-stack-p1-mollification-reference-se-v7-collection-lock.json",
        "source_collection_lock_sha256": "ad9dbcfb12fa6fb5bd06f6fe9724b75d1b9d309e8363757ff353202800a7f1fa",
        "source_shard_root": "data/reference-responses/layer-stack-p1-mollification-v1-reference-se-v7"
      }
    ]
  }
}
